{
  "version": "1.1",
  "source": {
    "format": "vtt",
    "encoding": "utf-8",
    "file_path": "skills/transcript/test_data/transcripts/edge_cases/unicode_speakers.vtt"
  },
  "metadata": {
    "duration_ms": 6000,
    "segment_count": 6,
    "detected_speakers": 6
  },
  "segments": [
    {
      "id": "seg-001",
      "start_ms": 0,
      "end_ms": 1000,
      "speaker": "ææ˜",
      "text": "ä½ å¥½ï¼Œä¸–ç•Œï¼",
      "raw_text": "<v ææ˜>ä½ å¥½ï¼Œä¸–ç•Œï¼</v>"
    },
    {
      "id": "seg-002",
      "start_ms": 1000,
      "end_ms": 2000,
      "speaker": "Ø£Ø­Ù…Ø¯",
      "text": "Ù…Ø±Ø­Ø¨Ø§ Ø¨Ø§Ù„Ø¹Ø§Ù„Ù…",
      "raw_text": "<v Ø£Ø­Ù…Ø¯>Ù…Ø±Ø­Ø¨Ø§ Ø¨Ø§Ù„Ø¹Ø§Ù„Ù…</v>"
    },
    {
      "id": "seg-003",
      "start_ms": 2000,
      "end_ms": 3000,
      "speaker": "Î•Î»Î­Î½Î·",
      "text": "Î“ÎµÎ¹Î± ÏƒÎ¿Ï… ÎºÏŒÏƒÎ¼Îµ",
      "raw_text": "<v Î•Î»Î­Î½Î·>Î“ÎµÎ¹Î± ÏƒÎ¿Ï… ÎºÏŒÏƒÎ¼Îµ</v>"
    },
    {
      "id": "seg-004",
      "start_ms": 3000,
      "end_ms": 4000,
      "speaker": "MÃ¼ller",
      "text": "Hallo Welt mit Umlauten: Ã¤Ã¶Ã¼",
      "raw_text": "<v MÃ¼ller>Hallo Welt mit Umlauten: Ã¤Ã¶Ã¼</v>"
    },
    {
      "id": "seg-005",
      "start_ms": 4000,
      "end_ms": 5000,
      "speaker": "ç”°ä¸­å¤ªéƒ",
      "text": "æ—¥æœ¬èªã®ãƒ†ã‚¹ãƒˆ",
      "raw_text": "<v ç”°ä¸­å¤ªéƒ>æ—¥æœ¬èªã®ãƒ†ã‚¹ãƒˆ</v>"
    },
    {
      "id": "seg-006",
      "start_ms": 5000,
      "end_ms": 6000,
      "speaker": "ğŸ¤ Emoji Host",
      "text": "Let's have some fun! ğŸ‰",
      "raw_text": "<v ğŸ¤ Emoji Host>Let's have some fun! ğŸ‰</v>"
    }
  ],
  "parse_metadata": {
    "parse_status": "complete",
    "parse_warnings": [],
    "parse_errors": [],
    "skipped_segments": []
  }
}
