{
  "version": "1.1",
  "source": {
    "format": "vtt",
    "encoding": "utf-8",
    "file_path": "skills/transcript/test_data/transcripts/edge_cases/timestamp_edge_cases.vtt"
  },
  "metadata": {
    "duration_ms": 3600000001,
    "segment_count": 7,
    "detected_speakers": 0
  },
  "segments": [
    {
      "id": "seg-001",
      "start_ms": 0,
      "end_ms": 1000,
      "speaker": null,
      "text": "No hours format - minimal",
      "raw_text": "No hours format - minimal"
    },
    {
      "id": "seg-002",
      "start_ms": 0,
      "end_ms": 1000,
      "speaker": null,
      "text": "With hours format",
      "raw_text": "With hours format"
    },
    {
      "id": "seg-003",
      "start_ms": 59999,
      "end_ms": 60000,
      "speaker": null,
      "text": "Minute boundary rollover",
      "raw_text": "Minute boundary rollover"
    },
    {
      "id": "seg-004",
      "start_ms": 59999,
      "end_ms": 60000,
      "speaker": null,
      "text": "Minute boundary with hours",
      "raw_text": "Minute boundary with hours"
    },
    {
      "id": "seg-005",
      "start_ms": 3599999999,
      "end_ms": 3600000000,
      "speaker": null,
      "text": "Extended hours (>2 digits) - long video",
      "raw_text": "Extended hours (>2 digits) - long video"
    },
    {
      "id": "seg-006",
      "start_ms": 500,
      "end_ms": 750,
      "speaker": null,
      "text": "Short duration (250ms)",
      "raw_text": "Short duration (250ms)"
    },
    {
      "id": "seg-007",
      "start_ms": 1,
      "end_ms": 2,
      "speaker": null,
      "text": "Minimal duration (1ms)",
      "raw_text": "Minimal duration (1ms)"
    }
  ],
  "parse_metadata": {
    "parse_status": "complete",
    "parse_warnings": [],
    "parse_errors": [],
    "skipped_segments": []
  }
}
