{
  "version": "1.1",
  "source": {
    "format": "vtt",
    "encoding": "utf-8",
    "file_path": "/Users/adam.nowak/workspace/GitHub/geekatron/jerry-gitwt/PROJ-008-transcript-skill/skills/transcript/test_data/transcripts/real/k8-network-policies-sample.vtt"
  },
  "metadata": {
    "duration_ms": 72768,
    "segment_count": 17,
    "detected_speakers": 2
  },
  "segments": [
    {
      "id": "seg-001",
      "start_ms": 3528,
      "end_ms": 6448,
      "speaker": "Alex Johnson",
      "text": "It's it has started, right?"
    },
    {
      "id": "seg-002",
      "start_ms": 5608,
      "end_ms": 10319,
      "speaker": "Sam Chen",
      "text": "All right. Yeah. So I guess I was a little interested in"
    },
    {
      "id": "seg-003",
      "start_ms": 10319,
      "end_ms": 16930,
      "speaker": "Sam Chen",
      "text": "where it's kind of recommended solutions and products rather than generic like,"
    },
    {
      "id": "seg-004",
      "start_ms": 16930,
      "end_ms": 20401,
      "speaker": "Sam Chen",
      "text": "well, sorry, whether recommended specific"
    },
    {
      "id": "seg-005",
      "start_ms": 20401,
      "end_ms": 24368,
      "speaker": "Sam Chen",
      "text": "implementations rather than just like concepts."
    },
    {
      "id": "seg-006",
      "start_ms": 24408,
      "end_ms": 31578,
      "speaker": "Sam Chen",
      "text": "So for example I saw like Cuverno in there and Cillium and things like that."
    },
    {
      "id": "seg-007",
      "start_ms": 25248,
      "end_ms": 25368,
      "speaker": "Alex Johnson",
      "text": "OK."
    },
    {
      "id": "seg-008",
      "start_ms": 31578,
      "end_ms": 38655,
      "speaker": "Sam Chen",
      "text": "I was wondering like are they have we have we recommended those if we if we"
    },
    {
      "id": "seg-009",
      "start_ms": 38655,
      "end_ms": 41728,
      "speaker": "Sam Chen",
      "text": "like or is that just like a yeah."
    },
    {
      "id": "seg-010",
      "start_ms": 39048,
      "end_ms": 42699,
      "speaker": "Alex Johnson",
      "text": "No, we no, we didn't. So there's a decision tree in there that"
    },
    {
      "id": "seg-011",
      "start_ms": 42699,
      "end_ms": 46872,
      "speaker": "Alex Johnson",
      "text": "I can walk you guys through. That's part of the like million artifacts."
    },
    {
      "id": "seg-012",
      "start_ms": 46872,
      "end_ms": 50291,
      "speaker": "Alex Johnson",
      "text": "So it actually did an analysis as part of it. It went out,"
    },
    {
      "id": "seg-013",
      "start_ms": 50291,
      "end_ms": 55101,
      "speaker": "Alex Johnson",
      "text": "it looked at multiple Kubernetes network interface drivers. It did the evaluation."
    },
    {
      "id": "seg-014",
      "start_ms": 55101,
      "end_ms": 58288,
      "speaker": "Alex Johnson",
      "text": "There's a matrix in here somewhere where it's like oh."
    },
    {
      "id": "seg-015",
      "start_ms": 56608,
      "end_ms": 56728,
      "speaker": "Sam Chen",
      "text": "OK."
    },
    {
      "id": "seg-016",
      "start_ms": 58808,
      "end_ms": 62230,
      "speaker": "Alex Johnson",
      "text": "This is Microsoft's official one. This new one I recommend is because it's"
    },
    {
      "id": "seg-017",
      "start_ms": 62230,
      "end_ms": 65104,
      "speaker": "Alex Johnson",
      "text": "the one that's deprecating the official recommended Microsoft."
    },
    {
      "id": "seg-018",
      "start_ms": 65104,
      "end_ms": 68343,
      "speaker": "Alex Johnson",
      "text": "There are other ones and that was its decision tree and as part of the"
    },
    {
      "id": "seg-019",
      "start_ms": 68343,
      "end_ms": 72175,
      "speaker": "Alex Johnson",
      "text": "orchestration run. So if I you know what, let me share my screen so I'm not talking"
    },
    {
      "id": "seg-020",
      "start_ms": 72175,
      "end_ms": 72768,
      "speaker": "Alex Johnson",
      "text": "to the ether."
    }
  ],
  "parse_metadata": {
    "parse_status": "complete",
    "parse_warnings": [],
    "parse_errors": [],
    "skipped_segments": []
  }
}
